"name","lat","lng"
"Cemetery Rd/College Cres (Parkville)",-37.79199,144.96119
"Rathdowne St/Princes St (Carlton)",-37.792625,144.970814
"Nicholson St/Princes St (Carlton)",-37.793139,144.975002
"Carlton Baths/Rathdowne St (Carlton)",-37.793813,144.971259
"Princes St/Rathdowne St (Carlton)",-37.792937,144.971169
"Wellington Pde/Hoddle St (East Melbourne)",-37.817112,144.989865
"West Richmond Railway Station/Hoddle St (East Melbourne)",-37.814956,144.990264
"Grey St/Hoddle St (East Melbourne)",-37.812423,144.990742
"Victoria Pde/Hoddle St (East Melbourne)",-37.810482,144.991067
"Cromwell St/Victoria Pde (East Melbourne)",-37.80993,144.989321
"Clarendon St/Victoria Pde (East Melbourne)",-37.809234,144.982922
"Eye & Ear Hospital/Victoria Pde (East Melbourne)",-37.808605,144.977215
"Lygon St/Cemetery Rd (Carlton)",-37.792914,144.967706
"Lygon St/Elgin St (Carlton)",-37.797298,144.967972
"Faraday St/Lygon St (Carlton)",-37.798936,144.967337
"Mercy Health Aged Care/William St (Parkville)",-37.77618,144.939758
"Auckland Lane/Cade Way (Parkville)",-37.77815,144.939022
"Parkville Ave/Garrard St (Parkville)",-37.779163,144.941321
"Royal Melb Hosp Royal Park/Poplar Rd (Parkville)",-37.779041,144.94674
"Royal Park Station/Poplar Rd (Parkville)",-37.780654,144.950851
"Melbourne Zoo/Poplar Rd (Parkville)",-37.783309,144.954775
"Princes Park/Royal Pde (Parkville)",-37.785405,144.959793
"Princes Park/Royal Pde (Parkville)",-37.784979,144.959101
"Melbourne Zoo/Poplar Rd (Parkville)",-37.783573,144.954949
"Royal Park Station/Poplar Rd (Parkville)",-37.780615,144.950694
"Royal Melb Hosp Royal Park/Poplar Rd (Parkville)",-37.779093,144.946569
"Parkville Ave/Garrard St (Parkville)",-37.778948,144.94085
"Auckland Lane/Cade Way (Parkville)",-37.778416,144.939287
"Mercy Health Aged Care/William St (Parkville)",-37.77617,144.939678
"Melrose St/Canning St (North Melbourne)",-37.795613,144.940989
"Dryburgh St/Shiel St (North Melbourne)",-37.797802,144.944063
"Abbotsford St/Haines St (North Melbourne)",-37.798294,144.945923
"Curzon St/Haines St (North Melbourne)",-37.7986,144.948459
"Morrah St/Royal Pde (Parkville)",-37.795529,144.95789
"The Avenue/Royal Pde (Parkville)",-37.791823,144.958322
"Trinity College/Royal Pde (Parkville)",-37.795778,144.958236
"Boundary Rd/Canning St (North Melbourne)",-37.79551,144.939243
"Melrose St/Canning St (North Melbourne)",-37.795817,144.941302
"Dryburgh St/Haines St (North Melbourne)",-37.79837,144.944593
"Pitt St/Rathdowne St (Carlton)",-37.79588,144.970895
"College Cres/Royal Pde (Parkville)",-37.792011,144.958748
"Rathdowne St/Elgin St (Carlton)",-37.797326,144.970106
"Elgin St/Lygon St (Carlton)",-37.797326,144.967528
"Kay St/Rathdowne St (Carlton)",-37.794977,144.970807
"Alexandra Ave/Punt Rd (South Yarra)",-37.830864,144.987764
"Moubray St/Punt Rd (South Yarra)",-37.848723,144.984426
"Alfred Hospital/Punt Rd (South Yarra)",-37.846404,144.984774
"Pasley St South/Punt Rd (South Yarra)",-37.843395,144.98539
"Lang St/Punt Rd (South Yarra)",-37.841105,144.985838
"Toorak Rd/Punt Rd (South Yarra)",-37.838681,144.986359
"Tivoli Pl/Punt Rd (South Yarra)",-37.836552,144.986803
"Witchwood Cl/Punt Rd (South Yarra)",-37.833769,144.987401
"Swan St/Punt Rd (Melbourne City)",-37.824778,144.9886
"Rowena Pde/Punt Rd (Richmond)",-37.821039,144.989201
"Anderson St/Alexandra Ave (South Yarra)",-37.82839,144.985355
"Melbourne Girls Grammar/Anderson St (South Yarra)",-37.832164,144.984184
"Domain Rd/Birdwood Ave (South Yarra)",-37.833812,144.982571
"Domain Rd/Birdwood Ave (South Yarra)",-37.833756,144.982425
"Melbourne Girls Grammar/Anderson St (South Yarra)",-37.831317,144.984207
"Wesley College/Moubray St (Melbourne City)",-37.847707,144.980374
"Punt Rd/Commercial Rd (South Yarra)",-37.845724,144.984565
"Alfred Hospital/Commercial Rd (Prahran)",-37.845272,144.981327
"Epsom Rd/Smithfield Rd (Kensington)",-37.789537,144.922387
"Gatehouse Dr/Smithfield Rd (Kensington)",-37.791337,144.919702
"Kensington Rd/Dynon Rd (West Melbourne)",-37.801363,144.914412
"330 Dynon Rd (West Melbourne)",-37.801928,144.919314
"Freight Terminal/Dynon Rd (West Melbourne)",-37.802508,144.924625
"Lloyd St/Dynon Rd (West Melbourne)",-37.802853,144.927829
"Dynon Rd/Kensington Rd (West Melbourne)",-37.800504,144.916765
"Opp 156-174 Kensington Rd (West Melbourne)",-37.799585,144.918324
"Childers St/Kensington Rd (Kensington)",-37.798273,144.920598
"Mercantile Pde/Kensington Rd (Kensington)",-37.797223,144.922376
"Epsom Rd/Smithfield Rd (Flemington)",-37.789364,144.922324
"Gatehouse Dr/Smithfield Rd (Kensington)",-37.790804,144.920149
"Dynon Rd/Kensington Rd (West Melbourne)",-37.800376,144.916689
"156 Kensington Rd (West Melbourne)",-37.798978,144.91917
"Hobsons Rd/Kensington Rd (Kensington)",-37.798126,144.920409
"Mercantile Pde/Kensington Rd (Kensington)",-37.797062,144.922438
"Devon St/Kensington Rd (Kensington)",-37.796404,144.923433
"Cairncross Lane/Kensington Rd (Kensington)",-37.795603,144.925
"Derby St/Kensington Rd (Kensington)",-37.794815,144.926362
"Kensington Station/Macaulay Rd (Kensington)",-37.794356,144.929963
"Albermarle St/Macaulay Rd (Kensington)",-37.794812,144.933857
"Macaulay Station/Macaulay Rd (North Melbourne)",-37.795093,144.936541
"Sims St/Dynon Rd (West Melbourne)",-37.801521,144.91367
"Altona St/Kensington Rd (Kensington)",-37.79621,144.924188
"Derby St/Kensington Rd (Kensington)",-37.795205,144.925976
"Kensington Station/Macaulay Rd (Kensington)",-37.79442,144.929519
"Albermarle St/Macaulay Rd (Kensington)",-37.794928,144.933797
"Macaulay Station/Macaulay Rd (North Melbourne)",-37.795197,144.936288
"Opp 330 Dynon Rd (West Melbourne)",-37.802148,144.92008
"Flemington Racecourse/Fisher Pde (Flemington)",-37.78944,144.903687
"Melbourne University/Royal Pde (Parkville)",-37.79843,144.957856
"Nicholson St/Elgin St (Fitzroy)",-37.797984,144.974313
"Rathdowne St/Elgin St (Carlton)",-37.797619,144.970927
"Victoria St/Rathdowne St (Carlton)",-37.806851,144.969016
"Flinders Lane/Queen St (Melbourne City)",-37.818093,144.962006
"Flinders Lane/Queen St (Melbourne City)",-37.817685,144.961824
"Collins St/Queen St (Melbourne City)",-37.816648,144.961296
"Little Collins St/Queen St (Melbourne City)",-37.816176,144.961104
"Bourke St/Queen St (Melbourne City)",-37.815268,144.960698
"Bourke St/Queen St (Melbourne City)",-37.814532,144.960366
"Bourke St/Queen St (Melbourne City)",-37.814468,144.960322
"Lonsdale St/Queen St (Melbourne City)",-37.813369,144.95983
"La Trobe St/Queen St (Melbourne City)",-37.811698,144.959069
"Queen Victoria Market/Franklin St (Melbourne City)",-37.809494,144.956188
"Queen Victoria Market/Peel St (Melbourne City)",-37.80933,144.955534
"William St/A'Beckett St (Melbourne City)",-37.810488,144.956331
"La Trobe St/Queen St (Melbourne City)",-37.810604,144.95885
"Lonsdale St/Queen St (Melbourne City)",-37.812548,144.959727
"Little Bourke St/Queen St (Melbourne City)",-37.813792,144.960295
"Bourke St/Queen St (Melbourne City)",-37.814628,144.960681
"Little Collins St/Queen St (Melbourne City)",-37.815682,144.961175
"Casino East/Queens Bridge St (Southbank)",-37.82209,144.961214
"Kavanagh St/Southbank Bvd (Southbank)",-37.823097,144.965776
"Victorian College of the Arts/Southbank Bvd (Southbank)",-37.823707,144.968248
"City Rd/Southbank Bvd (Southbank)",-37.823122,144.964651
"Casino East/Queens Bridge St (Southbank)",-37.821694,144.961259
"Old Melbourne Gaol/Russell St (Melbourne City)",-37.807495,144.965637
"Jeffcott St/Spencer St (West Melbourne)",-37.811891,144.950999
"Dudley St/Spencer St (West Melbourne)",-37.809809,144.949932
"Dudley St/Spencer St (West Melbourne)",-37.810496,144.950049
"Jeffcott St/Spencer St (West Melbourne)",-37.811814,144.950683
"Spencer St/Dudley St (West Melbourne)",-37.809992,144.950597
"King St/Dudley St (West Melbourne)",-37.809296,144.952036
"William St/Dudley St (West Melbourne)",-37.808701,144.954631
"Banana Alley Vaults/Flinders St (Melbourne City)",-37.819156,144.961943
"Market St/Flinders St (Melbourne City)",-37.818973,144.9618
"Little Lonsdale St/Russell St (Melbourne City)",-37.809574,144.966488
"Trades Hall/Lygon St (Carlton)",-37.806646,144.966046
"La Trobe St/Russell St (Melbourne City)",-37.808579,144.966311
"Little Lonsdale St/Exhibition St (Melbourne City)",-37.808841,144.968962
"Spring St/Lonsdale St (Melbourne City)",-37.80972,144.971323
"Exhibition St/Lonsdale St (Melbourne City)",-37.810444,144.968861
"Melbourne Central/Lonsdale St (Melbourne City)",-37.811567,144.965025
"Supreme Court/Lonsdale St (Melbourne City)",-37.813898,144.957021
"Lonsdale St/Spencer St (Melbourne City)",-37.814821,144.952077
"Spencer St/Lonsdale St (Melbourne City)",-37.814201,144.955297
"King St/Lonsdale St (Melbourne City)",-37.814288,144.955124
"County Court/Lonsdale St (Melbourne City)",-37.813453,144.957874
"Hardware Lane/Lonsdale St (Melbourne City)",-37.812636,144.960645
"Swanston St/Lonsdale St (Melbourne City)",-37.81131,144.965282
"Tattersalls Lane/Lonsdale St (Melbourne City)",-37.811327,144.965202
"Exhibition St/Lonsdale St (Melbourne City)",-37.809828,144.970252
"Stanley St/Spencer St (West Melbourne)",-37.808227,144.948613
"Hawke St/Spencer St (West Melbourne)",-37.80686,144.94672
"Abbotsford St/Spencer St (West Melbourne)",-37.805903,144.944554
"Dryburgh St/Spencer St (West Melbourne)",-37.80565,144.943437
"Hawke St/Spencer St (West Melbourne)",-37.807393,144.947307
"Flinders St/Queens Bridge St (Melbourne City)",-37.819456,144.96106
"Stanley St/Spencer St (West Melbourne)",-37.808671,144.948737
"Southern Cross Coach Terminal/Spencer St (Melbourne City)",-37.815084,144.951149
"Argyle Square/Lygon St (Carlton)",-37.802512,144.966727
"Radcliffe St/Dynon Rd (West Melbourne)",-37.803557,144.932023
"Queensberry St/Lygon St (Carlton)",-37.80457,144.966376
"Royal Melbourne Hospital/Royal Pde (Parkville)",-37.79774,144.957602
"Collins Square/Batmans Hill Dr (Docklands)",-37.821157,144.949027
"Batmans Hill Dr/Collins St (Docklands)",-37.820438,144.949115
"Melbourne Observatory/Birdwood Ave (Melbourne City)",-37.829848,144.974215
"Little Lonsdale St/Queen St (Melbourne City)",-37.811789,144.959135
"Shrine of Remembrance/Birdwood Ave (Melbourne City)",-37.829697,144.974321
"Melbourne University/Pelham St (Carlton)",-37.801993,144.959087
"Elizabeth St/Lonsdale St (Melbourne City)",-37.812511,144.961784
"King St/Lonsdale St (Melbourne City)",-37.814255,144.955807
"Royal Australasian College of Surgeons/Victoria Pde (East Melbourne)",-37.808092,144.972538
"Dudley St/Footscray Rd (West Melbourne)",-37.81226,144.942663
"Harcourt St/Courtney St (North Melbourne)",-37.799299,144.950802
"Courtney St/Wreckyn St (North Melbourne)",-37.800937,144.953301
"Royal Melbourne Hospital/Grattan St (Parkville)",-37.799438,144.955738
"Cardigan St/Grattan St (Carlton)",-37.800466,144.965114
"Lygon St/Grattan St (Carlton)",-37.800608,144.966552
"Southern Cross Station/Collins St (Melbourne City)",-37.819325,144.953509
"Southern Cross Station/Collins St (Melbourne City)",-37.819179,144.95341
"A'Beckett St/Queen St (Melbourne City)",-37.809659,144.95841
"Melbourne University/Pelham St (Carlton)",-37.802042,144.960346
"Melbourne University/Grattan St (Carlton)",-37.800116,144.96208
"Royal Melbourne Hospital/Flemington Rd (North Melbourne)",-37.800179,144.955332
"Royal Melbourne Hospital/Grattan St (Parkville)",-37.799409,144.955626
"Melbourne University/Grattan St (Parkville)",-37.800082,144.961661
"Moonee Ponds Creek/Footscray Rd (West Melbourne)",-37.810125,144.937031
"Footscray Rd (West Melbourne)",-37.807762,144.920037
"Moonee Ponds Creek/386 Footscray Rd (West Melbourne)",-37.809843,144.937414
"North Melbourne Station/Dryburgh St (West Melbourne)",-37.806807,144.942644
"Lincoln Square/Bouverie St (Carlton)",-37.801986,144.962335
"Abbotsford St/Haines St (North Melbourne)",-37.798607,144.946789
"Curzon St/Haines St (North Melbourne)",-37.798883,144.949212
"O'Shanassy St/Errol St (North Melbourne)",-37.799899,144.950104
"Dowling Pl/Wreckyn St (North Melbourne)",-37.801047,144.953423
"Swanston St/Grattan St (Carlton)",-37.800573,144.964532
"Lygon St/Grattan St (Carlton)",-37.800769,144.966514
"Rathdowne St/Grattan St (Carlton)",-37.801089,144.969379
"Westside Ave/Lorimer St (Port Melbourne)",-37.820874,144.919021
"715 Lorimer St (Port Melbourne)",-37.820678,144.924741
"Hall St/Lorimer St (Port Melbourne)",-37.820927,144.927131
"Graham St/Lorimer St (Port Melbourne)",-37.821479,144.930342
"Ingles St/Lorimer St (Port Melbourne)",-37.821931,144.932465
"Rogers St/Lorimer St (Port Melbourne)",-37.822729,144.936373
"Hartley St/Lorimer St (Southbank)",-37.823685,144.941027
"West Gate Fwy/Lorimer St (Southbank)",-37.825071,144.945056
"Lorimer St/Salmon St (Port Melbourne)",-37.821421,144.920891
"Turner St/Salmon St (Port Melbourne)",-37.823732,144.921622
"Phillip Ct/Salmon St (Port Melbourne)",-37.825888,144.9223
"Turner St/Salmon St (Port Melbourne)",-37.823738,144.921451
"Lorimer St/Salmon St (Port Melbourne)",-37.822405,144.921023
"Clarendon St/City Rd (Southbank)",-37.828235,144.957512
"West Gate Fwy/Lorimer St (Southbank)",-37.825308,144.94522
"Hartley St/Lorimer St (Southbank)",-37.823559,144.939463
"Rogers St/Lorimer St (Port Melbourne)",-37.823121,144.937101
"Ingles St/Lorimer St (Port Melbourne)",-37.82222,144.933002
"Graham St/Lorimer St (Port Melbourne)",-37.821562,144.929942
"Hall St/Lorimer St (Port Melbourne)",-37.820956,144.92571
"Salmon St/Lorimer St (Port Melbourne)",-37.82089,144.921474
"Westside Ave/Lorimer St (Port Melbourne)",-37.821109,144.91856
"City Rd/Queens Bridge St (Southbank)",-37.825552,144.960244
"Exhibition Building/Rathdowne St (Carlton)",-37.804299,144.969472
"Carlton Gardens/Rathdowne St (Carlton)",-37.801478,144.969947
"Elgin St/Rathdowne St (Carlton)",-37.797901,144.970534
"Freight Terminal/Dynon Rd (West Melbourne)",-37.802706,144.925142
"Lloyd St/Dynon Rd (West Melbourne)",-37.80324,144.929886
"Radcliffe St/Dynon Rd (West Melbourne)",-37.803835,144.932424
"Carlton Gardens/Victoria St (Carlton)",-37.807483,144.97118
"Melbourne Central/Lonsdale St (Melbourne City)",-37.811598,144.964195
"Collins St/Queen St (Melbourne City)",-37.816545,144.961571
"Clarendon St/City Rd (Southbank)",-37.82808,144.957425
"City Rd/Queens Bridge St (Southbank)",-37.82602,144.959743
"Victoria St/Rathdowne St (Carlton)",-37.806954,144.968752
"Exhibition Building/Rathdowne St (Carlton)",-37.804815,144.969106
"Grattan St/Lygon St (Carlton)",-37.801107,144.966755
"Argyle Square/Lygon St (Carlton)",-37.802626,144.966508
"Queensberry St/Lygon St (Carlton)",-37.805204,144.96604
"Adderley St/Dudley St (West Melbourne)",-37.810837,144.948404
"Festival Hall/Dudley St (West Melbourne)",-37.811035,144.947354
"Waterfront City/Footscray Rd (West Melbourne)",-37.811836,144.941095
"North Melbourne Station/Dryburgh St (West Melbourne)",-37.806943,144.942651
"Queen St/Lonsdale St (Melbourne City)",-37.813269,144.959219
"Melbourne University/Swanston St (Carlton)",-37.800121,144.963908
"Nicholson St/Elgin St (Carlton)",-37.797756,144.974138
"Faraday St/Lygon St (Carlton)",-37.798969,144.967143
"Melbourne Museum/Rathdowne St (Carlton)",-37.8023,144.96955
"Grattan St/Rathdowne St (Carlton)",-37.800692,144.969844
"Elgin St/Rathdowne St (Carlton)",-37.797762,144.970333
"A'Beckett St/Queen St (Melbourne City)",-37.810236,144.958405
"Todd Rd/Wharf Rd (Port Melbourne)",-37.827931,144.908893
"Fishermans Bend/Wharf Rd (Port Melbourne)",-37.82907,144.907065
"Todd Rd/Wharf Rd (Port Melbourne)",-37.827822,144.908828
"Wirraway Dr/Todd Rd (Port Melbourne)",-37.826247,144.911508
"Sabre Dr/Lorimer St (Port Melbourne)",-37.824674,144.906633
"Canberra St/Lorimer St (Port Melbourne)",-37.827327,144.90282
"Sardine St/Lorimer St (Port Melbourne)",-37.829531,144.901076
"Sardine St/Lorimer St (Port Melbourne)",-37.829981,144.900529
"Canberra St/Lorimer St (Port Melbourne)",-37.82695,144.902876
"Sabre Dr/Lorimer St (Port Melbourne)",-37.824519,144.906535
"DST Group/Lorimer St (Port Melbourne)",-37.821874,144.913403
"Bayside Ave/Lorimer St (Port Melbourne)",-37.821269,144.916397
"Bayside Ave/Lorimer St (Port Melbourne)",-37.821455,144.916187
"DST Group/Lorimer St (Port Melbourne)",-37.82207,144.913273
"Wirraway Dr/Todd Rd (Port Melbourne)",-37.825411,144.9116
"Perce White Reserve/Todd Rd (Port Melbourne)",-37.838189,144.915148
